topHeadlineFeatures,name,brand,mainImageUrl,phoneType,restImageUrl,bestBuyPrice,colors,processor,releasedOS,accessories,additionalFeatures,ram,overViewDescription,overViewReleaseDate,overViewMarketStaus,overViewPhoneWeight,overViewDimension,overViewBodyMaterial,overViewReleaseOS,cameraFrontcameraInMegaPixalWithFeatures,cameraRearCameraInMegaPixalWithFeatures,cameraVideoResolution,cameraOtherCameraFeatures,displayScreenSize,displayScreenResolution,displayScreenMaterial,displayDisplayTechnology,displayDtherDisplayFeatures,batteryTalkTime,batteryBatteryCapacity,batteryBatteryTechnology,InternalStorage,ExpendableStorageFeatures,connectivityAndFeaturesWireLessConnectivityFeatures,connectivityAndFeaturesDualSimSupportabilty,connectivityAndFeaturesBluetoothVersion,connectivityAndFeaturesSimCardSize,connectivityAndFeaturesChargingOptions,connectivityAndFeaturesSensors,connectivityAndFeaturesothersConnectivityFeatures,connectivityAndFeaturesNetworkFeatures
"Battery:2450 mAh, Li-ion~Camera:5 MP Primary|LED Flash|1.3 MP Front~Performance:Dual Core, 1.3 GHz|MediaTek|1 GB RAM~Display:4.5 inches (Medium)|480x854 px, Avg. sharp.",Swipe Konnect ME,Swipe,,,,"3,990",White,"Dual core, 1.3 GHz",Android v5.0 (Lollipop),Chipset:MediaTek,"Camera and Storage:The Swipe Konnect ME is armed with a 5MP snapper and LED flash at the back along with a 1.3MP snapper at the front. It sports an internal memory of 8GB which is further expandable up to 32GB.%Battery and Connectivity:The Swipe Konnect ME keeps the show running for a fair period of time without any disturbance with a 2,450mAh Li-ion battery. On the connectivity front, we have options like 3G, Wi-Fi, Bluetooth and USB port.%Display, Build and Configuration:The Swipe Konnect ME sports a 4.5-inch IPS LCD multi touch display with a resolution of 480 x 854 pixels and a pixel density of 218ppi. It has a thickness of 10.6mm and a weight of merely 91g so that you can easily tote around with it.",1 GB,,"April 28, 2015 (Official)",,91. grams,134.6 (H) x 66.7 (W) x 10.6 (T) mm,,,Resolution:1.3 MP,Resolution:5 MP~Flash:LED Flash~Image Resolution:2592 x 1944 Pixels~Camera Features:Digital Zoom,,,4.5 inches,480 x 854 pixels,IPS LCD,,"null~Touch Screen:Capacitive Touchscreen, Multi-touch",,2450 mAh,Li-ion,8 GB,Up to 32 GB,"4G: Not Available, 3G: Available, 2G: Available",,,,,,,"Dual SIM, GSM+GSM"
"Battery:1250 mAh, Li-ion~Camera:2 MP Primary|LED Flash|0.3 MP Front~Performance:Single Core, 1 GHz|256 MB RAM~Display:3.5 inches (Small)|320x480 px, Low sharp.",Videocon Z30 Pace,Videocon,,,,"1,731",Black~White,"Single core, 1 GHz",Android v4.4.2 (Kitkat),,"Camera and Storage:The Videocon Z30 Pace has been spotted with a 2MP digital camera and LED flash at the back along with a 0.3MP snapper at the front. It also causes problems with its low internal storage capacity of 512MB, which is of course, further expandable up to 16GB via microSD slot.%Battery and Connectivity:The Videocon Z30 Pace keeps the show running for a fair period of time without any interruption with a 1,250mAh Li-ion battery. On the connectivity front, we have options like 3G, Wi-Fi, Bluetooth, GPS/A-GPS and USB port.%Display, Build and Configuration:The Videocon Z30 Pace sports a 3.5-inch TFT multi-touch display with a resolution of 320 x 480 pixels (HVGA) and a pixel density of 165ppi. It is encased in a 10.3mm thick outfit which is available in white and black colours.",256 MB,,"April 23, 2015 (Official)",,,116 (H) x 61.6 (W) x 10 (T) mm,,,Resolution:0.3 MP,Resolution:2 MP~Flash:LED Flash~Image Resolution:1600 x 1200 Pixels~Camera Features:Digital Zoom,,,3.5 inches,320 x 480 pixels,TFT,,"null~Touch Screen:Capacitive Touchscreen, Multi-touch",,1250 mAh,Li-ion,512 MB,Up to 16 GB,"3G: Available, 2G: Available",,,,,,,"Dual SIM, GSM+GSM"
"Battery:1400 mAh, Li-ion~Camera:3.2 MP Primary|LED Flash|2 MP Front~Performance:Dual Core, 1 GHz|512 MB RAM~Display:4.0 inches (Small)|480x800 px, Avg. sharp.",Spice Stellar 441,Spice,,,,"4,999",Blue,"Dual core, 1 GHz",Android v4.4 (Kitkat),,"Battery and Connectivity:To keep the show running for a fair period of time without any disturbance, the Spice Stellar 441 is packed with a 1,400mAh Li-ion battery. Moving to the connectivity and networking section, we have options like 3G, Wi-Fi, Bluetooth, GPS and USB port.%Display and Configuration:The Spice Stellar 441 sports a 4-inch LCD multi-touch display which offers decent viewing experience with a resolution of 480 x 800 pixels and a pixel density of 233ppi. It ships with Android v4.4 KitKat OS. Acting as the brains of the device is a 1GHz dual-core processor. It is aided by a mere 512MB RAM which will pose lags even while running standard apps and games.%Camera, Storage and Multimedia:The Spice Stellar 441 is armed with a 3.2MP autofocus camera inclusive of LED flash at the back. It is accompanied by a 0.3MP front camera. It features a standard internal memory of 4GB which is further expandable up to 32GB via microSD slot.",512 MB,,"April 22, 2015 (Official)",,,,,,Resolution:2 MP,Resolution:3.2 MP~Flash:LED Flash~Image Resolution:2048 x 1536 Pixels~Camera Features:Digital Zoom,,,4.0 inches,480 x 800 pixels,LCD,,"null~Touch Screen:Capacitive Touchscreen, Multi-touch",,1400 mAh,Li-ion,4 GB,Up to 32 GB,"3G: Available, 2G: Available",,,,,,,"Dual SIM, GSM+GSM"
"Battery:2260 mAh, Li-Polymer|Non removable~Camera:13 MP Primary|LED Flash|5 MP Front~Performance:Octa Core, 1.5 GHz|Snapdragon 615|2 GB RAM~Display:5.0 inches (Medium)|HD, Avg. sharp.|Gorilla Glass",Micromax Canvas Knight 2 4G,Micromax,,,,"8,999",White,"Octa core, 1.5 GHz, Cortex A53",Android v5.0 (Lollipop),Chipset:Qualcomm Snapdragon 615 MSM8939~Architecture:64 bit~Graphics:Adreno 405~USB OTG Support:,"Camera and Storage:The Micromax Canvas Knight 2 4G flaunts a 13MP autofocus camera at the back which supports LED flash, HDR, touch focus, face detection and geo-tagging and can shoot 1,080p videos at 30fps. It is accompanied by a 5MP front snapper for selfies and video calls. It comes with an internal memory of 16GB which is further expandable via microSD slot.%Battery and Connectivity:The Micromax Canvas Knight 2 4G keeps the show running for a fair period of tiime without any interruption with its 2,600mAh Li-ion battery. Connectivity and networking options come in the form of 4G, 3G, Wi-Fi, Bluetooth v4.0, GPS/A-GPS and USB port.%Processor and OS:Doing duty under the hood is a 1.5GHz octa-core processor. It is aided by a 2GB DDR3 RAM thereby exhibiting fast and silky smooth performance. It boots Google's latest Android v5.0 Lollipop OS. %Display and Design:The Micromax Canvas Knight 2 4G carries a 5-inch AMOLED multi touch display with a resolution of 720 x 1,280 pixels (HD) and a pixel density of 294ppi. It comes with Corning Gorilla Glass 3 protection to stay away from scratches and smudges. despite being so big, it has a waistline of mere 6.3mm so that you can easily hold or slide it in your pocket. The all glass outfit is supported by metallic frame to exhibit an upmarket feel.",2 GB,,"June 13, 2015 (Official)",,,142 (H) x 72 (W) x 6.3 (T) mm,,,Resolution:5 MP,"Resolution:13 MP~Sensor:CMOS image sensor, Exmor-RS CMOS Sensor~Autofocus:~Flash:LED Flash~Image Resolution:4128 x 3096 Pixels~Settings:Exposure compensation, ISO control~Shooting Modes:Continuos Shooting, High Dynamic Range mode (HDR)~Camera Features:Digital Zoom, Auto Flash, Digital image stabilization, Face detection, Touch to focus~Video Recording:1920x1080 @ 30 fps",,,5.0 inches,HD (720 x 1280 pixels),AMOLED,,null~Screen to Body Ratio:67.25 %,Talktime:Up to 8 Hours(2G)Standby Time:Up to 335 Hours(2G),2260 mAh,Li-Polymer,16 GB,Up to 32 GB,"4G: Available (supports Indian bands) 3G: Available, 2G: Available",,,,,,,"Dual SIM, GSM+GSM"
"Battery:3000 mAh, Li-ion~Camera:5 MP Primary|LED Flash|0.3 MP Front~Performance:Dual Core, 1.3 GHz|512 MB RAM~Display:4.5 inches (Medium)|480x854 px, Avg. sharp.",Karbonn Alfa A120,Karbonn,,,,"3,949",Blue,"Dual core, 1.3 GHz",Android v4.4.2 (Kitkat),,"Camera and Storage:The Karbonn Alfa A120 has been spotted with a 5MP camera and LED flash at the back along with a 0.3MP snapper at the front. It houses a standard internal memory of 4GB which is further expandable up to 32GB via microSD slot.%Battery and Connectivity:The Karbonn Alfa A120 if fuelled by a 3,000mAh Li-ion battery which is rated to render up to 18 hours of talktime and up to 240 hours of standby time in 2G networks. On the connectivity front, we have options like 3G, USB port, Bluetooth, GPS and Wi-Fi.%Display, Configuration and OS:The Karbonn Alfa A120 sports a 4.5-inch IPS LCD multi touch display with a resolution of 480 x 854 pixels (FWVGA) and a pixel density of 218ppi. It sails on Android v4.4.2 KitKat OS. Acting as the brains of the smartphone is a 1.3GHz dual-core processor. It is aided by a mere 512MB RAM which will pose lags even while running standard games and applications.",512 MB,,"April 18, 2015 (Official)",,,,,,Resolution:0.3 MP,Resolution:5 MP~Flash:LED Flash~Image Resolution:2592 x 1944 Pixels~Camera Features:Digital Zoom,,,4.5 inches,480 x 854 pixels,IPS LCD,,"null~Touch Screen:Capacitive Touchscreen, Multi-touch",,3000 mAh,Li-ion,4 GB,Up to 32 GB,"3G: Available, 2G: Available",,,,,,,"Dual SIM, GSM+GSM"
"Battery:3120 mAh, Li-ion|Non removable~Camera:13 MP Primary|Dual-color LED Flash|5 MP Front~Performance:Quad Core, 1.7 GHz...|Snapdragon 615|2 GB RAM~Display:5.0 inches (Medium)|Full HD , Very sharp",Xiaomi Mi4i,Xiaomi,,,,"11,570",Black~Blue~Pink~White~Yellow,"Quad core, 1.7 GHz, Cortex A53 + Quad core, 1.1 GHz, Cortex A53",Android v5.0.2 (Lollipop),Chipset:Qualcomm Snapdragon 615 MSM8939~Graphics:Adreno 405~USB OTG Support:,"Camera and Memory:The Xiaomi Mi4i is loaded with a 13MP Sony autofocus camera which supports f/2.0 aperture, smile detection, face detection, touch focus, HDR and panorama and can record full HD videos at 30fps. It is accompanied by a 5MP front snapper for capturing quality selfies and video calls even under low light conditions. It sports an internal memory of 16GB without any microSD slot.%Battery and Communication:The Xiaomi Mi4i packs a massive 3,120mAh Li-Po battery which is non user removable and claims to render continuous service for days. Connectivity and networking features come in the form of LTE, 3G, Wi-Fi, Bluetooth, GPS etc.%Configuration and OS:At the helm of the Xiaomi Mi4i is a combination of 1.7GHz quad-core Cortex A-53 processor and 1.0GHz quad-core Cortex A-53 processor based on 64-bit Qualcomm MSM8916 Snapdragon 615 chipset. Together with a 2GB DDR3 RAM and Adreno 405 GPU, it offers blazing fast and glitch free performance. It ships with latest Android v5.0 Lollipop OS.%Display and Design:The Xiaomi Mi4i boasts of a 5-inch IPS OGS full HD JDI multi touch display which is bound to leave you stunned with pristine image quality, highly accurate colours, superior contrasts and greater outdoor visibility from wide angles. Despite being so big, it has a waistline of just 7.8mm and a very impressive weight of 130g. It comes in different colour options like blue, pink, yellow and black.",2 GB,,"April 23, 2015 (Official)",,130 grams,138.1 (H) x 69.6 (W) x 7.8 (T) mm,,,Resolution:5 MP~Autofocus:No~Flash:No~Camera Features:Wide Angle Selfie,"Resolution:13 MP~Sensor:CMOS image sensor~Autofocus:~Aperture:2.0 F~Optical Image Stabilisation:No~Flash:Dual-color LED Flash~Image Resolution:4128 x 3096 Pixels~Settings:Exposure compensation, ISO control~Shooting Modes:Continuos Shooting, High Dynamic Range mode (HDR)~Camera Features:Digital Zoom, Auto Flash, Digital image stabilization, Face detection, Smile detection, Touch to focus~Video Recording:1920x1080 @ 30 fps",,,5.0 inches,Full HD (1080 x 1920 pixels),IPS LCD,,SIM Size:SIM1: Micro SIM2: Micro~Fingerprint Sensor:No~Quick Charging:~Screen to Body Ratio:71.54 %,,3120 mAh,Li-ion,16 GB,No,"4G: Available (supports Indian bands) 3G: Available, 2G: Available",,,,,,SIM Size:SIM1: Micro SIM2: Micro~Fingerprint Sensor:No~Quick Charging:,"Dual SIM, GSM+GSM"
"Battery:2550 mAh, Li-ion~Camera:13 MP Primary|LED Flash|5 MP Front~Performance:Octa Core, 1.2 GHz|HiSilicon Kirin|2 GB RAM~Display:5.0 inches (Medium)|HD, Avg. sharp.",Honor Honor 4C,Honor,,,,"6,960",Black~Gold~White,"Octa core, 1.2 GHz, Cortex A53",Android v4.4 (Kitkat),Chipset:HiSilicon Kirin 620~Graphics:Mali-450~USB OTG Support:,"Battery and Connectivity:The Huawei Honor 4C sips juice from a 2,550mAh Li-ion battery and can be connected via 3G, GLONASS, Mobile hotspot, Wi-Fi, Bluetooth, USB port and GPS/A-GPS.%Camera and Memory:The Huawei Honor 4C comes with a 13MP autofocus camera which supports LED flash, panorama, face detection, geo-tagging, touch focus and HDR and can record full HD videos at 30fps. It also gets a 5MP front snapper which supports HD video recording. It has an internal memory of 8GB which is further expandable up to 32GB.%Display, Build and Configuration:The Huawei Honor 4C poses a 5-inch IPS LCD multi touch display with HD resolution and a pixel density of 294ppi. It is housed in an 8.8mm thick outfit which has a weight of 162g and is available in gold, white and black colours.",2 GB,,"May 8, 2015 (Official)",,162 grams,143.3 (H) x 71.9 (W) x 8.8 (T) mm,,,Resolution:5 MP,"Resolution:13 MP~Sensor:Back-illuminated sensor (BSI)~Autofocus:~Aperture:2.0 F~Flash:LED Flash~Image Resolution:4128 x 3096 Pixels~Camera Features:Digital Zoom, Face detection, Touch to focus~Video Recording:1920x1080 @ 30 fps",,,5.0 inches,HD (720 x 1280 pixels),IPS LCD,,"Custom UI:Emotion UI 3.0~SIM Size:SIM1: Micro~Touch Screen:Capacitive Touchscreen, Multi-touch",,2550 mAh,Li-ion,8 GB,Up to 32 GB,"4G: Not Available, 3G: Available, 2G: Available",,,,,,Custom UI:Emotion UI 3.0~SIM Size:SIM1: Micro,"Dual SIM, GSM+GSM"
"Battery:4000 mAh, Li-ion~Camera:8 MP Primary|LED Flash|3.2 MP Front~Performance:Quad Core, 1.3 GHz|1 GB RAM~Display:5.0 inches (Medium)|540x960 px, Avg. sharp.",IBall Andi 5F Infinito,IBall,,,,"8,599",Black,"Quad core, 1.3 GHz",Android v4.4 (Kitkat),,"Camera and Storage:The IBall Andi 5F Infinito has been spotted with an 8MP autofocus camera and LED flash at the back besides a 3.2MP front facing snapper for video calling and selfies. It houses an internal memory of 8GB which is further expandable up to 32GB.%Battery and Connectivity:The main attraction of the IBall Andi 5F Infinito is certainly the massive 4,000mAh Li-ion battery which has the ability to render continuous service for days, if used efficiently. On the connectivity front, it is loaded with regular options like dual SIM slots, GPRS/EDGE, 3G, Bluetooth, USB port, GPS and Wi-Fi.%Display and Configuration:The IBall Andi 5F Infinito sports a 5-inch IPS LCD multi touch display with a resolution of 540 x 960 pixels (qHD) and a pixel density of 220ppi. For driving its processes, it is loaded with a 1.3GHz quad-core processor paired with a 1GB RAM thereby ensuring fast and smooth management of standard applications. It runs on Android v4.4 KitKat OS.",1 GB,,"April 25, 2015 (Official)",,,,,,Resolution:3.2 MP,Resolution:8 MP~Flash:LED Flash~Image Resolution:3264 x 2448 Pixels~Camera Features:Digital Zoom,,,5.0 inches,540 x 960 pixels,IPS LCD,,"null~Touch Screen:Capacitive Touchscreen, Multi-touch",,4000 mAh,Li-ion,8 GB,Up to 32 GB,"3G: Available, 2G: Available",,,,,,,"Dual SIM, GSM+GSM"
"Battery:1750 mAh, Li-ion|7 Hours talktime (3G)~Camera:5 MP Primary|LED Flash|0.3 MP Front~Performance:Quad Core, 1.2 GHz|512 MB RAM~Display:4.0 inches (Small)|480x800 px, Avg. sharp.",Lava Iris X1 Atom,Lava,,,,"3,999",Black~White,"Quad core, 1.2 GHz",Android v4.4 (Kitkat),,"Camera and Storage:The Lava Iris X1 Atom has been spotted with a 5MP camera and LED flash at the back along with a 0.3MP front snapper for video calling. It houses a standard internal memory of 4GB which is further expandable up to 32GB via microSD slot.%Battery and Connectivity:The Lava Iris X1 Atom keeps the show running for a fair period of time without any disturbance with a 1,750mAh Li-ion battery. Moving to the connectivity and networking section, we have standard options like 3G, USB port, Bluetooth, GPS and Wi-Fi.%Display and Configuration:The Lava Iris X1 Atom carries a 4-inch TFT multi touch display with a resolution of 480 x 800 pixels (WVGA) leading to a pixel density of 233ppi. It runs on Android v4.4 KitKat OS. For driving its processes, the notebook is packed with a 1.5GHz quad-core processor. It is aided by a mere 512MB RAM which will pose problems even during standard multitasking.",512 MB,,"April 23, 2015 (Official)",,120 grams,125.5 (H) x 63.4 (W) x 9.6 (T) mm,,,Resolution:0.3 MP,Resolution:5 MP~Flash:LED Flash~Image Resolution:2592 x 1944 Pixels~Shooting Modes:High Dynamic Range mode (HDR)~Camera Features:Digital Zoom~Video Recording:1280x720 @ 30 fps,,,4.0 inches,480 x 800 pixels,TFT,,"null~Touch Screen:Capacitive Touchscreen, Multi-touch",Talktime:Up to 7 Hours(3G) / Up to 11 Hours(2G),1750 mAh,Li-ion,4 GB,Up to 32 GB,"4G: Not Available, 3G: Available, 2G: Available",,,,,,,"Dual SIM, GSM+GSM"
"Battery:2000 mAh, Li-ion|Non removable~Camera:8 MP Primary|LED Flash|2 MP Front~Performance:Quad Core, 1.3 GHz|MediaTek MT6582M|1 GB RAM~Display:4.7 inches (Medium)|540x960 px, Avg. sharp.|Gorilla Glass",Micromax Canvas Spark,Micromax,,,,"5,000",Black~White,"Quad core, 1.3 GHz, Cortex A7",Android v5.0 (Lollipop),Chipset:MediaTek MT6582M~Graphics:Mali-400 MP2~USB OTG Support:,"Battery and Connectivity:To keep the show running without any disturbance for a fair period of time, the Micromax Canvas Spark mobile relies on a 2,100mAh Li-ion battery. As far as connectivity specs are concerned, we have options like 3G, Wi-Fi, Bluetooth, GPS and USB port. Going by the reviews and full specifications, it considered as an excellent value for money device.%Camera and Memory:The Micromax Canvas Spark Q380 is armed with an 8MP snapper and LED flash at the back along with a 2MP snapper at the front. In terms of memory, the Micromax Canvas Spark features an internal storage of 8GB which is further expandable up to 32GB via microSD slot.%Display, Configuration and OS:The Micromax Canvas Spark carries a 4.7-inch IPS LCD multi-touch display with a resolution of 540 x 960 pixels and a pixel density of 234ppi. One of the key Micromax Canvas Spark specifications is its OS which is Google's latest Android v5.0 Lollipop platform. Justifying the Micromax Canvas Spark price in terms of configuration is a quad-core processor clocked at 1.3GHz, working in tandem with a 1GB RAM to render robust performance.",1 GB,,"April 22, 2015 (Official)",,134 grams,,,,Resolution:2 MP~Autofocus:No~Flash:No~Camera Features:Fixed Focus,"Resolution:8 MP~Sensor:PureCel Sensor~Autofocus:~Flash:LED Flash~Image Resolution:3264 x 2448 Pixels~Settings:Exposure compensation, ISO control~Shooting Modes:Continuos Shooting, High Dynamic Range mode (HDR)~Camera Features:Digital Zoom, Auto Flash, Face detection, Touch to focus~Video Recording:1280x720 @ 15 fps",,,4.7 inches,540 x 960 pixels,IPS LCD,,"Also Known As:Micromax Canvas Spark Q380~SIM Size:SIM1: Micro~Fingerprint Sensor:No~Quick Charging:No~Touch Screen:Capacitive Touchscreen, Multi-touch",Talktime:Up to 7 Hours(2G)Standby Time:Up to 335 Hours(2G),2000 mAh,Li-ion,8 GB,Up to 32 GB,"4G: Not Available, 3G: Available, 2G: Available",,,,,,Also Known As:Micromax Canvas Spark Q380~SIM Size:SIM1: Micro~Fingerprint Sensor:No~Quick Charging:No,"Dual SIM, GSM+GSM"
"Battery:2300 mAh, Li-ion|13 Hours talktime (3G)~Camera:8 MP Primary|LED Flash|2 MP Front~Performance:Quad Core, 1.2 GHz|Snapdragon 410|2 GB RAM~Display:5.0 inches (Medium)|HD, Avg. sharp.",Lenovo A6000 Plus,Lenovo,,,,"6,765",Black~Red~White~Yellow,"Quad core, 1.2 GHz, Cortex A53",Android v4.4.3 (Kitkat),Chipset:Qualcomm Snapdragon 410 MSM8916~Architecture:64 bit~Graphics:Adreno 306~USB OTG Support:No,"Battery and Connectivity:The Lenovo A6000 Plus runs the show with a 2,300mAh Li-ion battery and can be connected via 4G LTE Cat4, 3G, computer sync, GPS/A-GPS, tethering, Wi-Fi, OTA sync, USB Port and Bluetooth v4.0.%Camera and Memory:The Lenovo A6000 Plus comes with an 8MP autofocus camera at the back which supports LED flash, touch focus, geo-tagging and ISO control and can record full HD videos at 30fps. It is accompanied by a 2MP front snapper. It packs an internal memory of 16GB which is further expandable up to 32GB.%Display, Build and Configuration:The Lenovo A6000 Plus features a 5-inch IPS HD multi touch display wrapped in an 8.2mm thick outfit which has a weight of just 128g and is available in different colours like black, yellow, red and white.",2 GB,,"April 17, 2015 (Official)",,128 grams,141 (H) x 70 (W) x 8.2 (T) mm,,,Resolution:2 MP~Autofocus:No~Flash:No,"Resolution:8 MP~Sensor:CMOS image sensor~Autofocus:~Aperture:2.2 F~Optical Image Stabilisation:No~Flash:LED Flash~Image Resolution:3264 x 2448 Pixels~Settings:Exposure compensation, ISO control~Shooting Modes:Continuos Shooting, High Dynamic Range mode (HDR)~Camera Features:6 x Digital Zoom, Auto Flash, Digital image stabilization, Face detection, Touch to focus~Video Recording:1280x720 @ 30 fps",,,5.0 inches,HD (720 x 1280 pixels),IPS LCD,,Custom UI:Vibe 2.0 UI~SIM Size:SIM1: Micro~Fingerprint Sensor:No~Quick Charging:No~Screen to Body Ratio:69.67 %,Talktime:Up to 13 Hours(3G) / Up to 22 Hours(2G)Standby Time:Up to 264 Hours(3G) / Up to 264 Hours(2G),2300 mAh,Li-ion,16 GB,Up to 32 GB,"4G: Available (supports Indian bands) 3G: Available, 2G: Available",,,,,,Custom UI:Vibe 2.0 UI~SIM Size:SIM1: Micro~Fingerprint Sensor:No~Quick Charging:No,"Dual SIM, GSM+GSM"
"Battery:2200 mAh, Li-ion|26.2 Hours talktime (3G)~Camera:8 MP Primary|LED Flash|5 MP Front~Performance:Quad Core, 1.2 GHz|Snapdragon 200|1 GB RAM~Display:5.0 inches (Medium)|HD, Avg. sharp.",Microsoft Lumia 540 Dual SIM,Microsoft,,,,"6,099",Black~Blue~Orange~White,"Quad core, 1.2 GHz, Cortex A7",Windows Phone v8.1,Chipset:Qualcomm Snapdragon 200 MSM8212~Graphics:Adreno 302,"Camera and Storage:The Microsoft Lumia 540 Dual SIM is armed with an 8MP autofocus camera at the back which supports LED flash, BSI sensor, face detection, 1/4Â? sensor size, HDR and geo-tagging and can record 480p videos at 30fps. For selfies and video calling, it houses a 5MP snapper at the front. It sports an internal memory of 8GB which is further expandable up to 128GB via microSD slot.%Battery and Connectivity:The Microsoft Lumia 540 Dual SIM is fuelled by a 2,200mAh Li-ion battery which is rated to deliver up to 26 hours of calling time and up to 576 hours of standby time in 2G networks. On the connectivity front, we have options like 3G, GLONASS, Mobile hotspot, Bluetooth v4.0, Wi-Fi and USB port.%Processor and OS:Under the hood, the Microsoft Lumia 540 Dual SIM is packed with a 1.2GHz quad-core Cortex A7 processor based on Qualcomm Snapdragon 200 chipset. It is coupled with a 1GB RAM and Adreno 302 GPU to ensure robust handling of applications. It runs on latest Microsoft Windows 8.1 OS with Lumia Denim update and is further upgradable to the Windows 10 OS when launched.%Display and Design:The Microsoft Lumia 540 Dual SIM carries a 5-inch IPS LCD ClearBlack multi touch display with a resolution of 720 x 1,280 pixels and a pixel density of 294ppi. It has a thickness of 9.4mm and a weight of 152g and is available in different colours including white, blue, cyan, gray, orange and black.",1 GB,,"May 18, 2015 (Official)",,152 grams,144 (H) x 73.7 (W) x 9.4 (T) mm,,,Resolution:5 MP~Autofocus:No~Flash:No,"Resolution:8 MP~Sensor:Back-illuminated sensor (BSI)~Autofocus:~Aperture:2.2 F~Optical Image Stabilisation:No~Flash:LED Flash~Image Resolution:3264 x 2448 Pixels~Settings:Exposure compensation, ISO control~Shooting Modes:Continuos Shooting, High Dynamic Range mode (HDR)~Camera Features:Digital Zoom, Auto Flash, Digital image stabilization, Face detection, Touch to focus",,,5.0 inches,HD (720 x 1280 pixels),IPS LCD,,SIM Size:SIM1: Micro SIM2: Micro~Fingerprint Sensor:No~Quick Charging:No~Screen to Body Ratio:64.79 %,Talktime:Up to 26.2 Hours(3G) / Up to 14.8 Hours(2G)Standby Time:Up to 576 Hours(3G) / Up to 576 Hours(2G),2200 mAh,Li-ion,8 GB,Up to 128 GB,"4G: Not Available, 3G: Available, 2G: Available",,,,,,SIM Size:SIM1: Micro SIM2: Micro~Fingerprint Sensor:No~Quick Charging:No,"Dual SIM, GSM+GSM"
