topHeadlineFeatures,name,brand,mainImageUrl,phoneType,restImageUrl,bestBuyPrice,colors,processor,releasedOS,accessories,additionalFeatures,ram,overViewDescription,overViewReleaseDate,overViewMarketStaus,overViewPhoneWeight,overViewDimension,overViewBodyMaterial,overViewReleaseOS,cameraFrontcameraInMegaPixalWithFeatures,cameraRearCameraInMegaPixalWithFeatures,cameraVideoResolution,cameraOtherCameraFeatures,displayScreenSize,displayScreenResolution,displayScreenMaterial,displayDisplayTechnology,displayDtherDisplayFeatures,batteryTalkTime,batteryBatteryCapacity,batteryBatteryTechnology,InternalStorage,ExpendableStorageFeatures,connectivityAndFeaturesWireLessConnectivityFeatures,connectivityAndFeaturesDualSimSupportabilty,connectivityAndFeaturesBluetoothVersion,connectivityAndFeaturesSimCardSize,connectivityAndFeaturesChargingOptions,connectivityAndFeaturesSensors,connectivityAndFeaturesothersConnectivityFeatures,connectivityAndFeaturesNetworkFeatures
"Battery:1800 mAh, Li-ion~Camera:8 MP Primary|LED Flash|5 MP Front~Performance:Quad Core, 1.3 GHz|MediaTek|2 GB RAM~Display:4.7 inches (Medium)|HD, Sharp",Karbonn Titanium Mach One Plus,Karbonn,,,,"4,899",Black~White,"Quad core, 1.3 GHz",Android v5.0 (Lollipop),Chipset:MediaTek,"Display and configuration:The Karbonn Titanium One Plus comes with a 4.7-inch TFT display with a resolution of 720 x 1,280 pixels and a picture density of 312 ppi. The mobile is powered by a quad-core 1.3GHz processor on MediaTek chipset and a 2GB RAM. It runs Android v5.0 (Lollipop) as its operating system.%Connectivity and battery:Connections in this phone is not a problem as it supports all major type of connections like, GPRS, Bluetooth, USB, Wi-Fi, 3G and others. In the powerhouse department, it has 1,800mAH Li-ion battery that keeps the phone running.%Camera and storage:The karbonn phone is packed with a good set of cameras, 8MP in rear with a digital zoom and a 5MP at the front. The storage department documents 16GB internal memory which can be further stretched up to 32GB.",2 GB,,"July 15, 2015 (Official)",,136 grams,137 (H) x 68 (W) x 8.1 (T) mm,,,Resolution:5 MP~Sensor:BSI Sensor,"Resolution:8 MP~Flash:LED Flash~Image Resolution:3264 x 2448 Pixels~Shooting Modes:High Dynamic Range mode (HDR)~Camera Features:Digital Zoom, Face detection, Touch to focus",,,4.7 inches,HD (720 x 1280 pixels),TFT,,"null~Touch Screen:Capacitive Touchscreen, Multi-touch",Talktime:Up to 6 Hours(2G)Standby Time:Up to 250 Hours(2G),1800 mAh,Li-ion,16 GB,Up to 32 GB,"4G: Not Available, 3G: Available, 2G: Available",,,,,,,"Dual SIM, GSM+GSM"
"Battery:2500 mAh, Li-Polymer|9.5 Hours talktime (3G)~Camera:13 MP Primary|Dual LED Flash|8 MP Front~Performance:Quad Core, 1.3 GHz|MediaTek MT6735|2 GB RAM~Display:5.0 inches (Medium)|HD, Avg. sharp.",Lava Iris X5 4G,Lava,,,,"7,829",Black~White,"Quad core, 1.3 GHz, Cortex A53",Android v5.1.1 (Lollipop),Chipset:MediaTek MT6735~Architecture:64 bit~Graphics:Mali-T720 MP2,":%Camera and Storage:The device is packed with a 13MP rear auto focus camera with dual LED flash, and digital zooming. It also has an 8MP secondary camera to take good quality selfies which are a rage among everyone these days. It can take HD videos as well. It has an internal memory of 16GB which can be expanded furtherup to 32GB to store ample songs, videos, photos etc.%Battery and Connectivity:The The Lava Iris X5 4G is loaded with connectivity options such as GPRS, EDGE, 3G, 4G, Wi-Fi, and GPS for those who are reliant on the internet majorly. It has Bluetooth and USB support to connect it to other devices. To ensure that the users have access to uninterrupted entertainment, it is powered by a 2,500 mAh, li-ion battery.%Display and Configuration:The Lava Iris X5 4G features a 5.0-inch HD IPS LCD display with a resolution 720 x 1,280 pixels. It has a 1.3GHz quad-core processor coupled with 2GB of RAM and runs on Android v5.1.1 (Lollipop).",2 GB,,"July 30, 2015 (Official)",,128 grams,141.6 (H) x 70.8 (W) x 7.6 (T) mm,,,Resolution:8 MP~Flash:,"Resolution:13 MP~Sensor:CMOS image sensor~Aperture:2.0 F~Flash:Dual LED Flash~Image Resolution:4128 x 3096 Pixels~Settings:Exposure compensation, ISO control~Shooting Modes:Continuos Shooting, High Dynamic Range mode (HDR)~Camera Features:Digital Zoom, Auto Flash, Digital image stabilization, Face detection, Touch to focus~Video Recording:1920x1080 @ 30 fps",,,5.0 inches,HD (720 x 1280 pixels),IPS LCD,,"null~Touch Screen:Capacitive Touchscreen, Multi-touch",Talktime:Up to 9.5 Hours(3G) / Up to 24.5 Hours(2G),2500 mAh,Li-Polymer,16 GB,Up to 32 GB,"4G: Available (supports Indian bands) 3G: Available, 2G: Available",,,,,,,"Dual SIM, GSM+GSM"
"Battery:1300 mAh, Li-ion~Camera:3.2 MP Primary|LED Flash|0.3 MP Front~Performance:Dual Core, 1.3 GHz|512 MB RAM~Display:4.0 inches (Small)|320x520 px, Low sharp.",Karbonn Titanium S15 Ultra,Karbonn,,,,"2,799",Black~White,"Dual core, 1.3 GHz",Android v4.4.2 (Kitkat),,"Connectivity and Battery:The Karbonn Titanium S15 Ultra is a dual SIM phone offering a wide range of connectivity options like GPRS, 3G,and Wi-Fi for connecting it to the internet. Bluetooth support and a micro-USB port for transfer of data. It also has GPS for accurate navigation. The phone is backed by a 1,300mAh li-ion battery which gives decent talk time. %Camera and Memory:The Karbonn Titanium S15 Ultra is equipped with a 3.2MP main camera with LED flash digital zooming. It also has a 0.3MP front camera to capture selfies and for video calling. The Karbonn Titanium S15 Ultra   has an internal memory of 4GB that can be expanded up to 32GB with the help of an external memory card.%Display and Configuration:The Karbonn Titanium S15 Ultra features a 4-inch TFT display with a resolution of 320 x 520 pixels along with a pixel density of 153 ppi. It is powered by a strong 1.3GHz dual-core processor coupled with 512MB of RAM for ease of working. It runs on Android KitKat operating system. The phone is available in black and white.",512 MB,,"July 13, 2015 (Official)",,,,,,Resolution:0.3 MP,Resolution:3.2 MP~Flash:LED Flash~Image Resolution:2048 x 1536 Pixels~Camera Features:Digital Zoom,,,4.0 inches,320 x 520 pixels,TFT,,"null~Touch Screen:Capacitive Touchscreen, Multi-touch",,1300 mAh,Li-ion,4 GB,Up to 32 GB,"4G: Not Available, 3G: Available, 2G: Available",,,,,,,"Dual SIM, GSM+GSM"
"Battery:1500 mAh, Li-ion~Camera:3 MP Primary|LED Flash|0.3 MP Front~Performance:Quad Core, 1.2 GHz|512 MB RAM~Display:4.0 inches (Small)|480x800 px, Avg. sharp.",Panasonic T33,Panasonic,,,,"3,990",Blue~White,"Quad core, 1.2 GHz",Android v4.4.2 (Kitkat),,"Connectivity and Battery:The Panasonic T33 is a dual SIM phone offering a wide range of connectivity options like GPRS, 3G,and Wi-Fi for connecting it to the internet. Bluetooth support and a micro-USB port for transfer of data. The phone is backed by a 1,500mAh li-ion battery which gives decent talk time. %Camera and Memory:The phone is equipped with a 3MP main camera with LED flash digital zooming. It also has a 0.3MP front camera to capture selfies and for video calling. The Panasonic T33 has an internal memory of 4GB that can be expanded up to 32GB with the help of an external memory card.%Display and Configuration:The Panasonic T33 is a sleek, premium looking phone which features a 4-inch IPS LCD display with a resolution of 480 x 800 pixels along with a pixel density of 233 ppi. It is powered by a strong 1.2GHz quad-core processor coupled with 512MB of RAM for ease of working. It runs on Android KitKat operating system. The phone is available in Pearl White and Duke Blue.",512 MB,,"July 22, 2015 (Official)",,126 grams,128.5 (H) x 65 (W) x 10.1 (T) mm,,,Resolution:0.3 MP,Resolution:3 MP~Flash:LED Flash~Image Resolution:2000 x 1504 Pixels~Camera Features:Digital Zoom,,,4.0 inches,480 x 800 pixels,IPS LCD,,"null~Touch Screen:Capacitive Touchscreen, Multi-touch",,1500 mAh,Li-ion,4 GB,Up to 32 GB,"4G: Not Available, 3G: Available, 2G: Available",,,,,,,"Dual SIM, GSM+GSM"
"Battery:3200 mAh, Li-Polymer|23.5 Hours talktime (3G)|Non removable~Camera:13 MP Primary|LED Flash|5 MP Front~Performance:Octa Core, 1.5 GHz|Snapdragon 615|2 GB RAM~Display:5.5 inches (Large)|Full HD , Very sharp|Gorilla Glass",XOLO Black,XOLO,,,,"8,790",Black,"Octa core, 1.5 GHz, Cortex A53",Android v5.0 (Lollipop),Chipset:Qualcomm Snapdragon 615 MSM8939~Architecture:64 bit~Graphics:Adreno 405,"Connectivity and Battery:The device supports various forms of connectivity like GPRS, Wi-Fi, 3G and 4G which gives full access to the internet. It also has a Bluetooth and USB support for connecting it to other devices. It has a 3,200mAh li-po non-removable battery which provides talk time of up to 36 hours on 2G mode.%Display and configuration:The XOLO Black is a good looking smartphone with its slim design and glass body. It is a dual SIM phone which features a 5.5-inch Full HD IPS LCD  touchscreen with a resolution of 1,080 x 1,920 pixels. It is powered by a 1.5GHz octa core processor coupled with 2GB of RAM. The device runs on Android v5.0 (Lollipop) operating system.%Camera and memory:The XOLO Black comes equipped with dual cameras at the back, one being 13MP and the other being 2MP to focus and capture shots with brilliance and ease. It also has a secondary camera of 5MP with flash for clicking decent selfies even on low light conditions and online video chatting. The device has an impressive internal memory of 16GB and is expandable up to 32GB with an external memory card.",2 GB,,"July 13, 2015 (Official)",,139 grams,155.5 (H) x 76.6 (W) x 7.3 (T) mm,,,Resolution:5 MP~Sensor:BSI Sensor~Aperture:2.0 F~Flash:LED Flash,"Resolution:13 MP + 2 MP~Sensor:PureCel Sensor~Aperture:2.0 F~Flash:LED Flash~Image Resolution:4128 x 3096 Pixels~Settings:Exposure compensation, ISO control~Shooting Modes:Continuos Shooting, High Dynamic Range mode (HDR)~Camera Features:Digital Zoom, Optical Zoom, Auto Flash, Digital image stabilization, Face detection, Touch to focus~Video Recording:1920x1080 @ 30 fps",,,5.5 inches,Full HD (1080 x 1920 pixels),IPS LCD,,"Custom UI:HIVE Atlas UI~SIM Size:SIM1: Micro SIM2: Hybrid(Nano)~Quick Charging:~Touch Screen:Capacitive Touchscreen, Multi-touch",Talktime:Up to 23.5 Hours(3G) / Up to 36 Hours(2G)Standby Time:Up to 698 Hours(3G) / Up to 735 Hours(2G),3200 mAh,Li-Polymer,16 GB,Up to 32 GB,"4G: Available (supports Indian bands) 3G: Available, 2G: Available",,,,,,Custom UI:HIVE Atlas UI~SIM Size:SIM1: Micro SIM2: Hybrid(Nano)~Quick Charging:,"Dual SIM, GSM+GSM"
"Battery:2000 mAh, Li-ion~Camera:5 MP Primary|LED Flash|2 MP Front~Performance:Quad Core, 1.2 GHz|512 MB RAM~Display:5.0 inches (Medium)|480x800 px, Low sharp.",Karbonn Aura,Karbonn,,,,"3,806",Blue~Gold,"Quad core, 1.2 GHz",Android v4.4 (Kitkat),,"Connectivity and Battery:The Karbonn Aura is a dual SIM phone and offers a wide range of connectivity options ranging from GPRS, 3G, Wi-Fi for internet access to Bluetooth and USB support. The phone is backed by a 2,000mAh li-ion battery.%Camera and Memory:The Karbonn Aura is stacked with an impressive 5MP main camera with LED flash and a front camera of 2MP for selfies and video chatting. It has an internal memory of 8GB and allows you to extend the memory to up to 32GB with a microSD card. The memory card support  ensures that you face no problem in storing all your important documents, videos, songs and pictures.%Display and Configuration:The Karbonn Aura features a 4.5-inch IPS LCD display with a screen resolution of 480 x 854 pixels along with a pixel density of 218 ppi. It is powered by a strong 1.2GHz quad-core processor coupled with 512MB of RAM. It runs on Android KitKat operating system.",512 MB,,"July 8, 2015 (Official)",,,,,,Resolution:2 MP,Resolution:5 MP~Flash:LED Flash~Image Resolution:2592 x 1944 Pixels~Camera Features:Digital Zoom,,,5.0 inches,480 x 800 pixels,IPS LCD,,"null~Touch Screen:Capacitive Touchscreen, Multi-touch",,2000 mAh,Li-ion,8 GB,Up to 32 GB,"4G: Not Available, 3G: Available, 2G: Available",,,,,,,"Dual SIM, GSM+GSM"
"Battery:1200 mAh, Li-ion~Camera:1.3 MP Primary|No Flash|0.3 MP Front~Performance:Single Core, 1 GHz|Spreadtrum SC7715|512 MB RAM~Display:3.5 inches (Small)|480x854 px, Avg. sharp.",Micromax Bolt S301,Micromax,,,,"1,861",Black,"Single core, 1 GHz, Cortex A7",Android v4.4.2 (Kitkat),Chipset:Spreadtrum SC7715~Graphics:Mali-400 MP,"Connectivity and Battery:Connectivity options of the  Micromax Bolt S301 include GPRS, 3G, Wi-Fi for staying connected to the internet and GPS for accuracy in directions. It has Bluetooth and USB support for transferring and receiving files and data. It has a 1,200mAh li-ion battery which gives ample talk time and phone usage.%Camera and Memory:The Micromax Bolt S301 has an 1.3MP rear camera. It has a 0.3MP front snapper for online video chatting needs. The device has an internal storage capacity of 4GB and can be expanded up to 16GB with an external memory card.%Display and Configuration:The Micromax Bolt S301 features a 3.5-inch TFT display with a resolution of 480 x 854 pixels. It has a pixel density of 280 ppi. It is powered by a 1GHz single-core processor with 512MB of RAM. It runs on Android KitKat operating system.",512 MB,,"July 8, 2015 (Official)",,,,,,Resolution:0.3 MP~Autofocus:No~Flash:No,Resolution:1.3 MP~Autofocus:No~Optical Image Stabilisation:No~Flash:No~Image Resolution:1280 x 1024 Pixels~Camera Features:Digital Zoom,,,3.5 inches,480 x 854 pixels,TFT,,"Fingerprint Sensor:No~Quick Charging:No~Touch Screen:Capacitive Touchscreen, Multi-touch",,1200 mAh,Li-ion,4 GB,Up to 16 GB,"4G: Not Available, 3G: Available, 2G: Available",,,,,,Fingerprint Sensor:No~Quick Charging:No,"Dual SIM, GSM+GSM"
"Battery:1750 mAh, Li-ion~Camera:8 MP Primary|LED Flash|2 MP Front~Performance:Quad Core, 1.2 GHz|1 GB RAM~Display:5.0 inches (Medium)|HD, Avg. sharp.",Karbonn Titanium Dazzle 3 S204,Karbonn,,,,"4,699",Black~White,"Quad core, 1.2 GHz",Android v5.0 (Lollipop),,"Connectivity and Battery:It is a dual SIM phone and offers a wide range of connectivity options like GPRS, 3G and Wi-Fi for surfing the internet. Bluetooth and micro-USB port to connect it to other devices. The phone is backed by a powerful 1,700mAh li-ion battery which gives up to 9 hours of talk time.%Camera and Memory:The phone houses a decent 8.0MP main camera with LED Flash and autofocus which is decent. It also has a front camera of 2.0MP for online video chatting and clicking selfies. It has an internal memory of 8GB and allows users to extend the memory of up to 32GB with a microSD-card.%Display and Configuration:The Karbonn Titanium Dazzle 3 S204 features an elegant 5-inch IPS LCD display with a resolution of 720 x 1,280 pixels along with a pixel density of 294 ppi. It is powered by a strong 1.2GHz quad-core processor with 1GB RAM which assures smooth functionality of the device. The device is compact looking and comes in black and white colour. It runs on Android Lollipop operating system.",1 GB,,"July 14, 2015 (Official)",,143 grams,145 (H) x 72.6 (W) x 8.2 (T) mm,,,Resolution:2 MP,Resolution:8 MP~Flash:LED Flash~Camera Features:Digital Zoom,,,5.0 inches,HD (720 x 1280 pixels),IPS LCD,,"null~Touch Screen:Capacitive Touchscreen, Multi-touch",Talktime:Up to 9 Hours(2G)Standby Time:Up to 250 Hours(2G),1750 mAh,Li-ion,8 GB,Up to 32 GB,"4G: Not Available, 3G: Available, 2G: Available",,,,,,,"Dual SIM, GSM+GSM"
"Battery:3000 mAh, Li-ion|22 Hours talktime (3G)|Non removable~Camera:16 MP Primary|LED Flash|5 MP Front~Performance:Quad Core, 2.1 GHz...|Samsung Exynos 7 Octa|4 GB RAM~Display:5.7 inches (Large)|1440x2560 px, Very sharp|Gorilla Glass",Samsung Galaxy Note 5,Samsung,,,,"41,999",Black~Gold~Silver~White,"Quad core, 2.1 GHz, ARM Cortex A57 + Quad core, 1.5 GHz, Cortex A53",Android v5.1.1 (Lollipop),Chipset:Samsung Exynos 7 Octa 7420~Architecture:64 bit~Graphics:Mali-T760 MP8~USB OTG Support:,":%Battery and connectivity:To keep the smartphone running, there is a 3000mAh Li-ion battery that gives a talktime of up to 20 hours on 3G. The phone covers almost all possible connectivity options including Wi-Fi and Bluetooth along with USB. The device is compatible with 4G and can be used as hotspot and OTA sync is also available for use.%Display, configuration and OS:The Samsung Galaxy Note 5 is one of SamsungÂ?s latest product that raises the bar with its gorgeous display and powerful processor. The device arrives with 5.7-inch large super Amoled display with a screen resolution of 2,160 x 3,840 pixels. It has Corning Gorilla glass that resists scratches and user marks. The smartphone runs the latest version of Android Lollipop and is powered by 2.1GHz octa-core processor coupled with 4GB RAM which makes it one of the best in its class. The Galaxy Note 5 comes with a unique and exclusive 'S Pen' tool that makes multi-tasking much more convenient. The feature not only gives the luxury to write and draw but captures single image of long pages that require you to scroll. The phone also allows you to open two applications on a single screen.%Camera and storage:The Galaxy Note 5 raises the bar with its outstanding 16MP camera that will delight camera fanatics; however it disappoints a little with its 5MP front camera. The main features of camera include Auto Flash, continuous shooting, optical image stabilization, self timer among others. The device has an internal memory of 32GB which is non-expandable.",4 GB,,"September 8, 2015 (Official)",,171 grams,153.2 (H) x 76.1 (W) x 7.6 (T) mm,,,Resolution:5 MP~Flash:No~Camera Features:Wide Angle Selfie,"Resolution:16 MP~Sensor:Exmor-RS CMOS Sensor~Autofocus:~Aperture:1.9 F~Optical Image Stabilisation:~Flash:LED Flash~Image Resolution:4616 x 3464 Pixels~Settings:Exposure compensation, ISO control~Shooting Modes:Continuos Shooting, High Dynamic Range mode (HDR), Burst mode~Camera Features:Digital Zoom, Auto Flash, Face detection, Smile detection, Touch to focus~Video Recording:3840x2160 @ 30 fps, 1920x1080 @ 60 fps, 1280x720 @ 120 fps~Video Recording Features:Optical Image stabilization, Dual Video Recording",,,5.7 inches,1440 x 2560 pixels,Super AMOLED,,SIM Size:SIM1: Nano~Fingerprint Sensor:~Quick Charging:~Screen to Body Ratio:76.65 %,Talktime:Up to 22 Hours(3G),3000 mAh,Li-ion,32 GB,No,"4G: Available (supports Indian bands) 3G: Available, 2G: Available",,,,,,SIM Size:SIM1: Nano~Fingerprint Sensor:~Quick Charging:,"Single SIM, GSM"
"Battery:2050 mAh, Li-Polymer~Camera:13 MP Primary|LED Flash|5 MP Front~Performance:Octa Core, 1.4 GHz|MediaTek MT6592M|2 GB RAM~Display:5.0 inches (Medium)|HD, Avg. sharp.",Panasonic Eluga Z,Panasonic,,,,"7,479",Blue~Gold~White,"Octa core, 1.4 GHz, Cortex A7",Android v4.4 (Kitkat),Chipset:MediaTek MT6592M~Graphics:Mali-450 MP4,"Connectivity and Battery:The device has dual SIM facility and supports various forms of connectivity like GPRS, Wi-Fi, and 3G which gives full access to the internet. It also has a Bluetooth and USB support for connecting it to other devices. The Panasonic Eluga Z has OTG support to connect your external memory devices. It has a 2,050mAh li-po battery which provides decent talk time with its fast charging feature.%Display and configuration:The Panasonic Eluga Z is a good looking smartphone with its slim design and glass body. It is a dual SIM phone which features a 5-inch HD AMOLED touchscreen with a resolution of 720 x 1,080 pixels. It is powered by a 1.4GHz octa core processor coupled with 2GB of RAM. The device runs on Android KitKat operating system. It comes in Champagne Gold, Ivory White, and Midnight Blue colour variants.%Camera and memory:The Panasonic Eluga Z comes equipped with a 13MP rear camera which has digital zooming and LED flash. It also has a secondary camera of 5MP for selfie lovers and for online video chatting. The device houses an internal memory of 16GB and is expandable up to 32GB with an external memory card.",2 GB,,"July 13, 2015 (Official)",,120 grams,141.3 (H) x 70.6 (W) x 6.8 (T) mm,,,Resolution:5 MP~Camera Features:Fixed Focus,"Resolution:13 MP~Flash:LED Flash~Image Resolution:4128 x 3096 Pixels~Settings:Exposure compensation, ISO control~Shooting Modes:Continuos Shooting, High Dynamic Range mode (HDR)~Camera Features:Digital Zoom, Face detection, Touch to focus~Video Recording:1920x1080 @ 30 fps",,,5.0 inches,HD (720 x 1280 pixels),AMOLED,,"null~Touch Screen:Capacitive Touchscreen, Multi-touch",,2050 mAh,Li-Polymer,16 GB,Up to 32 GB,"4G: Not Available, 3G: Available, 2G: Available",,,,,,,"Dual SIM, GSM+GSM"
"Battery:2300 mAh, Li-ion|Non removable~Camera:13 MP Primary|LED Flash|5 MP Front~Performance:Quad Core, 1.2 GHz|Snapdragon 410|2 GB RAM~Display:5.0 inches (Medium)|HD, Avg. sharp.",Vivo V1,Vivo,,,,"13,990",Gold~Silver,"Quad core, 1.2 GHz, Cortex A53",Android v5.0 (Lollipop),Chipset:Qualcomm Snapdragon 410 MSM8916~Architecture:64 bit~Graphics:Adreno 306,"Connectivity and Battery:It is a Dual SIM phone and offers a wide range of connectivity options ranging from GPRS/EDGE, 3G, 4G, and Wi-Fi along with a micro-USB port. It also has GPS for navigation. The phone is backed by a decent 2,300mAh li-ion battery.%Camera and Memory:The phone is stacked with an impressive 13.0MP main camera with autofocus and LED Flash for capturing low light images. It also has a front camera of 5.0MP which will ensure good quality selfies and video chats. It has a decent internal memory of 16GB and allows users to extend the memory to up to 128GB with an external microSD card.%Display and Configuration:The Vivo V1 features an elegant 5.0-inch IPS LCD display with a screen resolution of 720 x 1,280 pixels along with a pixel density of 294 ppi. It is powered by a strong 1.4GHz quad-core processor with 2GB RAM which assures smooth functionality of the device. It has a customized FunTouch UI which is based on the Android 5.0 Lollipop operating system. The phone will be available in Silver and Gold colour. ",2 GB,,"July 17, 2015 (Official)",,145 grams,143.3 (H) x 71 (W) x 6.8 (T) mm,,,Resolution:5 MP,"Resolution:13 MP~Sensor:CMOS image sensor~Flash:LED Flash~Image Resolution:4128 x 3096 Pixels~Settings:Exposure compensation, ISO control~Shooting Modes:Continuos Shooting, High Dynamic Range mode (HDR)~Camera Features:Digital Zoom, Auto Flash, Digital image stabilization, Face detection, Touch to focus~Video Recording:1920x1080 @ 30 fps",,,5.0 inches,HD (720 x 1280 pixels),IPS LCD,,"null~Touch Screen:Capacitive Touchscreen, Multi-touch",,2300 mAh,Li-ion,16 GB,Up to 128 GB,"4G: Available (supports Indian bands) 3G: Available, 2G: Available",,,,,,,"Dual SIM, GSM+GSM"
"Battery:2900 mAh, Li-ion~Camera:5 MP Primary|LED Flash|2 MP Front~Performance:Quad Core, 1.2 GHz|Spreadtrum SC7731|512 MB RAM~Display:4.0 inches (Small)|480x800 px, Avg. sharp.",Intex Aqua Y2 Power,Intex,,,,"3,169",Black~Blue~White,"Quad core, 1.2 GHz, Cortex A7",Android v4.4.2 (Kitkat),Chipset:Spreadtrum SC7731~Graphics:Mali-400 MP2,"Connectivity and Battery:Like most smartphones, The Intex Aqua Y2 Power offers a variety of connectivity options to the users that include Bluetooth, GPRS, 3G, Wi-Fi and USB connectivity. The dual SIM phone houses a 2,900mAh Li-ion battery that gives a talk time of up to 20 hours on 2G mode.%Camera and Memory:The Intex Aqua Y2 Power is stacked with 5MP main camera with LED flash having features like panaroma, HDR, timestamp, freeze-frame display, slow motion video, photo while recording etc. It also has a 2MP front camera for clicking selfies and online video chatting. The device houses an internal memory of 4GB and can be expanded to up to 32GB which should give users enough space to download and store songs and videos.%Display and Configuration:The Intex Aqua Y2 Power features a 4-inch TFT display with a resolution of 480 x 800 pixels. The Aqua Y2 is good to look at. The device is powered by 1.2GHz quad-core processor coupled with 512MB RAM. The phone runs on Android v4.4.2 KitKat.",512 MB,,"July 8, 2015 (Official)",,133 grams,126 (H) x 64 (W) x 10.5 (T) mm,,,Resolution:2 MP~Flash:No,"Resolution:5 MP~Sensor:CMOS image sensor~Autofocus:~Optical Image Stabilisation:No~Flash:LED Flash~Image Resolution:2592 x 1944 Pixels~Settings:Exposure compensation, ISO control~Shooting Modes:Continuos Shooting, High Dynamic Range mode (HDR)~Camera Features:Digital Zoom, Auto Flash, Digital image stabilization, Touch to focus",,,4.0 inches,480 x 800 pixels,TFT,,SIM Size:SIM1: Mini SIM2: Micro~Fingerprint Sensor:No~Quick Charging:No~Screen to Body Ratio:56.47 %,Talktime:Up to 20 Hours(2G)Standby Time:Up to 500 Hours(2G),2900 mAh,Li-ion,4 GB,Up to 32 GB,"4G: Not Available, 3G: Available, 2G: Available",,,,,,SIM Size:SIM1: Mini SIM2: Micro~Fingerprint Sensor:No~Quick Charging:No,"Dual SIM, GSM+GSM"
